{
  "schema": "afi.provider.v1",
  "providerId": "afi-provider-technical-local",
  "recordVersion": "1.0.0",
  "displayName": "AFI Local Technical Indicators (keyless)",
  "supportedCategories": ["technical"],
  "executionClass": "local",
  "deterministic": true,
  "adapterId": "afi-adapter-technical-local",
  "requiresCredential": false,
  "status": "active"
}
